{
  "dimension": "Numeral",
  "locale": "da",
  "source_file": "/Users/link/Project/duckling/Duckling/Numeral/DA/Rules.hs",
  "rules": [
    {
      "name": "zeroNineteen_dictionary",
      "rule_type": "dictionary",
      "pattern": {
        "type": "dictionary",
        "entries": {
          "ingen": {
            "value": 0
          },
          "nul": {
            "value": 0
          },
          "intet": {
            "value": 0
          },
          "en": {
            "value": 1
          },
          "et": {
            "value": 1
          },
          "én": {
            "value": 1
          },
          "ét": {
            "value": 1
          },
          "to": {
            "value": 2
          },
          "tre": {
            "value": 3
          },
          "fire": {
            "value": 4
          },
          "fem": {
            "value": 5
          },
          "seks": {
            "value": 6
          },
          "syv": {
            "value": 7
          },
          "otte": {
            "value": 8
          },
          "ni": {
            "value": 9
          },
          "ti": {
            "value": 10
          },
          "elleve": {
            "value": 11
          },
          "tolv": {
            "value": 12
          },
          "tretten": {
            "value": 13
          },
          "fjorten": {
            "value": 14
          },
          "femten": {
            "value": 15
          },
          "seksten": {
            "value": 16
          },
          "sytten": {
            "value": 17
          },
          "atten": {
            "value": 18
          },
          "nitten": {
            "value": 19
          }
        },
        "case_sensitive": false
      },
      "production": {
        "value_extractor": "dictionary_lookup",
        "confidence": 1.0
      },
      "examples": [
        "ingen",
        "nul",
        "intet",
        "en",
        "et"
      ]
    },
    {
      "name": "NumeralsPrefixWithNegativeOrMinus",
      "rule_type": "regex",
      "pattern": {
        "type": "regex",
        "value": "-|minus|negativ",
        "flags": "i"
      },
      "production": {
        "value_extractor": "custom",
        "custom_logic": "NEEDS_MANUAL_REVIEW: prod = \\tokens -> case tokens of\n      (_:Token Numeral NumeralData{TNumeral.value = v",
        "confidence": 1.0
      },
      "metadata": {
        "original_name": "numbers prefix with -, negative or minus",
        "_needs_manual_review": true
      }
    },
    {
      "name": "Few",
      "rule_type": "regex",
      "pattern": {
        "type": "regex",
        "value": "(nogle )?få",
        "flags": "i"
      },
      "production": {
        "value_extractor": "custom",
        "custom_logic": "NEEDS_MANUAL_REVIEW: prod = \\_ -> integer 3\n  ",
        "confidence": 1.0
      },
      "metadata": {
        "original_name": "few",
        "_needs_manual_review": true
      }
    },
    {
      "name": "Ten",
      "rule_type": "regex",
      "pattern": {
        "type": "regex",
        "value": "ti",
        "flags": "i"
      },
      "production": {
        "value_extractor": "custom",
        "custom_logic": "NEEDS_MANUAL_REVIEW: prod = \\_ -> integer 10 >>= withGrain 1\n  ",
        "confidence": 1.0
      },
      "metadata": {
        "original_name": "ten",
        "_needs_manual_review": true
      }
    },
    {
      "name": "DecimalWithThousandsSeparator",
      "rule_type": "regex",
      "pattern": {
        "type": "regex",
        "value": "(\\\\d+(\\\\.\\\\d\\\\d\\\\d)+\\\\,\\\\d+)",
        "flags": "i"
      },
      "production": {
        "value_extractor": "custom",
        "custom_logic": "NEEDS_MANUAL_REVIEW: prod = \\tokens -> case tokens of\n      (Token RegexMatch (GroupMatch (match:_)):_) ->\n        parseDouble (Text.replace \".\" Text.empty match) >>= double\n      _ -> Nothing\n  ",
        "confidence": 1.0
      },
      "metadata": {
        "original_name": "decimal with thousands separator",
        "_needs_manual_review": true
      }
    },
    {
      "name": "DecimalNumeral",
      "rule_type": "regex",
      "pattern": {
        "type": "regex",
        "value": "(\\\\d*,\\\\d+)",
        "flags": "i"
      },
      "production": {
        "value_extractor": "custom",
        "custom_logic": "NEEDS_MANUAL_REVIEW: prod = \\tokens -> case tokens of\n      (Token RegexMatch (GroupMatch (match:_)):_) ->\n        parseDecimal False match\n      _ -> Nothing\n  ",
        "confidence": 1.0
      },
      "metadata": {
        "original_name": "decimal number",
        "_needs_manual_review": true
      }
    },
    {
      "name": "Single",
      "rule_type": "regex",
      "pattern": {
        "type": "regex",
        "value": "enkelt",
        "flags": "i"
      },
      "production": {
        "value_extractor": "custom",
        "custom_logic": "NEEDS_MANUAL_REVIEW: prod = \\_ -> integer 1 >>= withGrain 1\n  ",
        "confidence": 1.0
      },
      "metadata": {
        "original_name": "single",
        "_needs_manual_review": true
      }
    },
    {
      "name": "PowersOfTen",
      "rule_type": "regex",
      "pattern": {
        "type": "regex",
        "value": "(hundrede?|tohundrede|tusinde?|totusinde|million(er)?)",
        "flags": "i"
      },
      "production": {
        "value_extractor": "custom",
        "custom_logic": "NEEDS_MANUAL_REVIEW: prod = \\tokens -> case tokens of\n      (Token RegexMatch (GroupMatch (match:_)):_) -> case Text.toLower match of\n        \"hundred\"   -> double 1e2 >>= withGrain 2 >>= withMultipliable\n        \"hundred",
        "confidence": 1.0
      },
      "metadata": {
        "original_name": "powers of tens",
        "_needs_manual_review": true
      }
    },
    {
      "name": "APair",
      "rule_type": "regex",
      "pattern": {
        "type": "regex",
        "value": "et par",
        "flags": "i"
      },
      "production": {
        "value_extractor": "custom",
        "custom_logic": "NEEDS_MANUAL_REVIEW: prod = \\_ -> integer 2 >>= withGrain 1\n  ",
        "confidence": 1.0
      },
      "metadata": {
        "original_name": "a pair",
        "_needs_manual_review": true
      }
    },
    {
      "name": "Dozen",
      "rule_type": "regex",
      "pattern": {
        "type": "regex",
        "value": "dusin",
        "flags": "i"
      },
      "production": {
        "value_extractor": "custom",
        "custom_logic": "NEEDS_MANUAL_REVIEW: prod = \\_ -> integer 12 >>= withGrain 1 >>= withMultipliable\n  ",
        "confidence": 1.0
      },
      "metadata": {
        "original_name": "dozen",
        "_needs_manual_review": true
      }
    },
    {
      "name": "Integer",
      "rule_type": "regex",
      "pattern": {
        "type": "regex",
        "value": "(intet|ingen|nul|en|et|én|ét|to|tretten|tre|fire|femten|fem|seksten|seks|syv|otte|nitten|ni|ti|elleve|tolv|fjorten|sytten|atten)",
        "flags": "i"
      },
      "production": {
        "value_extractor": "dictionary_lookup",
        "dictionary_ref": "zeroNineteenMap",
        "confidence": 1.0
      },
      "metadata": {
        "original_name": "integer (0..19)"
      }
    },
    {
      "name": "Integer2",
      "rule_type": "regex",
      "pattern": {
        "type": "regex",
        "value": "(tyve|tredive|fyrre|halvtreds|tres|halvfjerds|firs|halvfems)",
        "flags": "i"
      },
      "production": {
        "value_extractor": "custom",
        "custom_logic": "NEEDS_MANUAL_REVIEW: prod = \\tokens -> case tokens of\n      (Token RegexMatch (GroupMatch (match:_)):_) -> case Text.toLower match of\n        \"tyve\" -> integer 20\n        \"tredive\" -> integer 30\n        \"fyrre\" -> integer",
        "confidence": 1.0
      },
      "metadata": {
        "original_name": "integer (20..90)",
        "_needs_manual_review": true
      }
    },
    {
      "name": "Integer3",
      "rule_type": "composite",
      "pattern": {
        "type": "composite",
        "operator": "sequence",
        "components": [],
        "_raw_haskell": " oneOf [20, 30 .. 90",
        "_needs_manual_review": true
      },
      "production": {
        "value_extractor": "composite_function",
        "function": "UNKNOWN",
        "confidence": 1.0,
        "_needs_manual_review": true
      },
      "metadata": {
        "original_name": "integer 21..99",
        "_needs_manual_review": true
      }
    },
    {
      "name": "Intersect",
      "rule_type": "composite",
      "pattern": {
        "type": "composite",
        "operator": "sequence",
        "components": [],
        "_raw_haskell": " Predicate hasGrain\n    , Predicate $ and . sequence [not . isMultipliable, isPositive",
        "_needs_manual_review": true
      },
      "production": {
        "value_extractor": "composite_function",
        "function": "UNKNOWN",
        "confidence": 1.0,
        "_needs_manual_review": true
      },
      "metadata": {
        "original_name": "intersect",
        "_needs_manual_review": true
      }
    },
    {
      "name": "Multiply",
      "rule_type": "composite",
      "pattern": {
        "type": "composite",
        "operator": "sequence",
        "components": [],
        "_raw_haskell": " dimension Numeral\n    , Predicate isMultipliable\n    ",
        "_needs_manual_review": true
      },
      "production": {
        "value_extractor": "composite_function",
        "function": "UNKNOWN",
        "confidence": 1.0,
        "_needs_manual_review": true
      },
      "metadata": {
        "original_name": "compose by multiplication",
        "_needs_manual_review": true
      }
    }
  ],
  "metadata": {
    "extracted_at": "2026-02-14T23:27:26.140948",
    "extractor_version": "1.0.0",
    "extraction_method": "python_regex",
    "rules_needing_review": 13,
    "notes": "Auto-extracted by extract_rules.py. Rules marked with _needs_manual_review require human verification."
  }
}