{
  "dimension": "Numeral",
  "locale": "km",
  "source_file": "Duckling/Numeral/KM/Rules.hs",
  "rules": [
    {
      "name": "ruleNumeral_dictionary",
      "rule_type": "dictionary",
      "pattern": {
        "type": "dictionary",
        "entries": {
          "០": {
            "value": 0
          },
          "១": {
            "value": 1
          },
          "២": {
            "value": 2
          },
          "៣": {
            "value": 3
          },
          "៤": {
            "value": 4
          },
          "៥": {
            "value": 5
          },
          "៦": {
            "value": 6
          },
          "៧": {
            "value": 7
          },
          "៨": {
            "value": 8
          },
          "៩": {
            "value": 9
          },
          "សូន្យ": {
            "value": 0
          },
          "មួយ": {
            "value": 1
          },
          "ពីរ": {
            "value": 2
          },
          "បី": {
            "value": 3
          },
          "បួន": {
            "value": 4
          },
          "ប្រាំ": {
            "value": 5
          },
          "ប្រាំមួយ": {
            "value": 6
          },
          "ប្រាំពីរ": {
            "value": 7
          },
          "ប្រាំបី": {
            "value": 8
          },
          "ប្រាំបួន": {
            "value": 9
          }
        },
        "case_sensitive": false
      },
      "production": {
        "value_extractor": "dictionary_lookup",
        "confidence": 1.0
      },
      "examples": [
        "០",
        "១",
        "២",
        "៣",
        "៤"
      ]
    },
    {
      "name": "ruleTens_dictionary",
      "rule_type": "dictionary",
      "pattern": {
        "type": "dictionary",
        "entries": {
          "ដប់": {
            "value": 10
          },
          "ម្ភៃ": {
            "value": 20
          },
          "សាម": {
            "value": 30
          },
          "សែ": {
            "value": 40
          },
          "ហា": {
            "value": 50
          },
          "ហុក": {
            "value": 60
          },
          "ចិត": {
            "value": 70
          },
          "ប៉ែត": {
            "value": 80
          },
          "កៅ": {
            "value": 90
          }
        },
        "case_sensitive": false
      },
      "production": {
        "value_extractor": "dictionary_lookup",
        "confidence": 1.0
      },
      "examples": [
        "ដប់",
        "ម្ភៃ",
        "សាម",
        "សែ",
        "ហា"
      ]
    },
    {
      "name": "Numeral",
      "rule_type": "regex",
      "pattern": {
        "type": "regex",
        "value": "(០|១|២|៣|៤|៥|៦|៧|៨|៩|ប្រាំបួន|ប្រាំបី|ប្រាំពីរ|ប្រាំមួយ|ប្រាំ|បួន|បី|ពីរ|មួយ|សូន្យ)",
        "flags": "i"
      },
      "production": {
        "value_extractor": "dictionary_lookup",
        "dictionary_ref": "ruleNumeralMap",
        "confidence": 1.0
      },
      "metadata": {
        "original_name": "integer (0..9)"
      }
    },
    {
      "name": "Tens",
      "rule_type": "regex",
      "pattern": {
        "type": "regex",
        "value": "(កៅ|ប៉ែត|ចិត|ហុក|ហា|សែ|សាម|ម្ភៃ|ដប់)",
        "flags": "i"
      },
      "production": {
        "value_extractor": "dictionary_lookup",
        "dictionary_ref": "ruleTensMap",
        "confidence": 1.0
      },
      "metadata": {
        "original_name": "integer (10..90)"
      }
    },
    {
      "name": "PowersOfTen",
      "rule_type": "regex",
      "pattern": {
        "type": "regex",
        "value": "(រយ|ពាន់|ម៉ឺន|សែន|លាន)",
        "flags": "i"
      },
      "production": {
        "value_extractor": "custom",
        "custom_logic": "NEEDS_MANUAL_REVIEW: prod = \\tokens -> case tokens of\n      (Token RegexMatch (GroupMatch (match:_)):_) -> case match of\n        \"រយ\" -> double 1e2 >>= withGrain 2 >>= withMultipliable\n        \"ពាន់\" -> double 1e3 >>= wit",
        "confidence": 1.0
      },
      "metadata": {
        "original_name": "powers of tens",
        "_needs_manual_review": true
      }
    },
    {
      "name": "CompositeTens",
      "rule_type": "composite",
      "pattern": {
        "type": "composite",
        "operator": "sequence",
        "components": [],
        "_raw_haskell": " oneOf [10, 20 .. 90",
        "_needs_manual_review": true
      },
      "production": {
        "value_extractor": "composite_function",
        "function": "UNKNOWN",
        "confidence": 1.0,
        "_needs_manual_review": true
      },
      "metadata": {
        "original_name": "integer (11..99)",
        "_needs_manual_review": true
      }
    },
    {
      "name": "Sum",
      "rule_type": "composite",
      "pattern": {
        "type": "composite",
        "operator": "sequence",
        "components": [],
        "_raw_haskell": " Predicate $ and . sequence [hasGrain, isPositive",
        "_needs_manual_review": true
      },
      "production": {
        "value_extractor": "composite_function",
        "function": "UNKNOWN",
        "confidence": 1.0,
        "_needs_manual_review": true
      },
      "metadata": {
        "original_name": "intersect 2 numbers",
        "_needs_manual_review": true
      }
    },
    {
      "name": "Multiply",
      "rule_type": "composite",
      "pattern": {
        "type": "composite",
        "operator": "sequence",
        "components": [],
        "_raw_haskell": " dimension Numeral\n    , Predicate isMultipliable\n    ",
        "_needs_manual_review": true
      },
      "production": {
        "value_extractor": "composite_function",
        "function": "UNKNOWN",
        "confidence": 1.0,
        "_needs_manual_review": true
      },
      "metadata": {
        "original_name": "compose by multiplication",
        "_needs_manual_review": true
      }
    }
  ],
  "metadata": {
    "extracted_at": "2026-02-15T21:03:05.229511",
    "extractor_version": "1.0.0",
    "extraction_method": "python_regex",
    "rules_needing_review": 4,
    "notes": "Auto-extracted by extract_rules.py. Rules marked with _needs_manual_review require human verification."
  }
}